{
  "$schema": "https://json-schema.org/draft/2020-12/schema",
  "$id": "https://github.com/ai-orchestrator/docs/pricing/schema.json",
  "title": "ai-orchestrator model pricing catalog",
  "type": "object",
  "required": ["schema_version", "currency", "unit", "updated_at", "providers"],
  "properties": {
    "schema_version": { "type": "string" },
    "currency": { "type": "string", "const": "USD" },
    "unit": { "type": "string", "const": "per_1m_tokens" },
    "updated_at": { "type": "string", "format": "date-time" },
    "provider_aliases": {
      "type": "object",
      "additionalProperties": { "type": "string" }
    },
    "providers": {
      "type": "object",
      "additionalProperties": {
        "type": "object",
        "required": ["display_name", "models"],
        "properties": {
          "display_name": { "type": "string" },
          "models": {
            "type": "object",
            "additionalProperties": { "$ref": "#/$defs/model" }
          }
        }
      }
    }
  },
  "$defs": {
    "model": {
      "type": "object",
      "required": ["id", "provider", "status", "pricing", "source_url", "verified_at"],
      "properties": {
        "id": { "type": "string" },
        "provider": { "type": "string" },
        "status": { "type": "string", "enum": ["active", "deprecated", "preview", "unknown"] },
        "aliases": {
          "type": "array",
          "items": { "type": "string" }
        },
        "pricing": {
          "oneOf": [
            { "type": "null" },
            {
              "type": "object",
              "required": ["input", "output"],
              "properties": {
                "input": { "type": "number" },
                "output": { "type": "number" },
                "cache_write": { "type": "number" },
                "cache_read": { "type": "number" }
              }
            }
          ]
        },
        "purpose": {
          "type": "object",
          "properties": {
            "summary": { "type": "string" },
            "strengths": { "type": "array", "items": { "type": "string" } },
            "weaknesses": { "type": "array", "items": { "type": "string" } },
            "recommended_for": { "type": "array", "items": { "type": "string" } },
            "avoid_for": { "type": "array", "items": { "type": "string" } },
            "routing_weight": { "type": "number", "minimum": 0, "maximum": 1 }
          }
        },
        "source_url": { "type": "string" },
        "verified_at": { "type": "string", "format": "date" },
        "notes": { "type": "string" }
      }
    }
  }
}
