{
  "schema_version": "1.0",
  "currency": "USD",
  "unit": "per_1m_tokens",
  "updated_at": "2026-09-26T00:00:00Z",
  "provider_aliases": {
    "claude": "anthropic",
    "anthropic": "anthropic",
    "openai": "openai",
    "deepseek": "deepseek",
    "gemini": "google",
    "google": "google"
  },
  "providers": {
    "anthropic": {
      "display_name": "Anthropic",
      "models": {
        "claude-sonnet-4-6": {
          "id": "claude-sonnet-4-6",
          "provider": "anthropic",
          "status": "active",
          "aliases": [],
          "pricing": { "input": 3.00, "output": 15.00, "cache_write": 3.75, "cache_read": 0.30 },
          "purpose": {
            "summary": "Modelo balanceado de Claude para arquitectura, seguridad y código complejo.",
            "strengths": ["architecture", "security_review", "code_review", "reasoning"],
            "weaknesses": ["low_cost", "boilerplate"],
            "recommended_for": ["decisiones de arquitectura", "revisión de seguridad", "código complejo o ambiguo"],
            "avoid_for": ["boilerplate masivo", "formateo simple"],
            "routing_weight": 0.85
          },
          "source_url": "https://platform.claude.com/docs/en/about-claude/pricing",
          "verified_at": "2026-09-26"
        },
        "claude-opus-4-8": {
          "id": "claude-opus-4-8",
          "provider": "anthropic",
          "status": "active",
          "aliases": [],
          "pricing": { "input": 5.00, "output": 25.00, "cache_write": 6.25, "cache_read": 0.50 },
          "purpose": {
            "summary": "Modelo flagship de Claude para las tareas más complejas: razonamiento profundo, investigación y decisiones críticas.",
            "strengths": ["architecture", "security_review", "reasoning", "code_review", "long_context"],
            "weaknesses": ["low_cost", "low_latency", "boilerplate"],
            "recommended_for": ["problemas de alta complejidad", "arquitectura crítica", "investigación profunda", "razonamiento multi-paso"],
            "avoid_for": ["boilerplate masivo", "tareas simples", "volumen de alto costo"],
            "routing_weight": 0.95
          },
          "source_url": "https://platform.claude.com/docs/en/about-claude/pricing",
          "verified_at": "2026-09-26"
        },
        "claude-haiku-4-5-20251001": {
          "id": "claude-haiku-4-5-20251001",
          "provider": "anthropic",
          "status": "active",
          "aliases": [],
          "pricing": { "input": 1.00, "output": 5.00, "cache_write": 1.25, "cache_read": 0.10 },
          "purpose": {
            "summary": "Modelo económico/rápido de Claude para tareas simples.",
            "strengths": ["low_latency", "low_cost", "boilerplate", "documentation"],
            "weaknesses": ["architecture", "security_review"],
            "recommended_for": ["boilerplate", "completar código corto", "formateo"],
            "avoid_for": ["decisiones de arquitectura", "auditoría de seguridad"],
            "routing_weight": 0.5
          },
          "source_url": "https://platform.claude.com/docs/en/about-claude/pricing",
          "verified_at": "2026-09-26"
        },
        "claude-fable-5": {
          "id": "claude-fable-5",
          "provider": "anthropic",
          "status": "active",
          "aliases": [],
          "pricing": { "input": 10.00, "output": 50.00, "cache_write": 12.50, "cache_read": 1.00 },
          "source_url": "https://platform.claude.com/docs/en/about-claude/pricing",
          "verified_at": "2026-09-26"
        },
        "claude-opus-5-5": {
          "id": "claude-opus-5-5",
          "provider": "anthropic",
          "status": "active",
          "aliases": [],
          "pricing": { "input": 4.00, "output": 20.00, "cache_write": 5.00, "cache_read": 0.20 },
          "source_url": "https://platform.claude.com/docs/en/about-claude/pricing",
          "verified_at": "2026-09-26"
        },
        "claude-opus-5": {
          "id": "claude-opus-5",
          "provider": "anthropic",
          "status": "active",
          "aliases": [],
          "pricing": { "input": 5.00, "output": 25.00, "cache_write": 6.25, "cache_read": 0.50 },
          "source_url": "https://platform.claude.com/docs/en/about-claude/pricing",
          "verified_at": "2026-09-26"
        },
        "claude-sonnet-5": {
          "id": "claude-sonnet-5",
          "provider": "anthropic",
          "status": "active",
          "aliases": [],
          "pricing": { "input": 2.00, "output": 10.00, "cache_write": 2.50, "cache_read": 0.20 },
          "source_url": "https://platform.claude.com/docs/en/about-claude/pricing",
          "verified_at": "2026-09-26"
        }
      }
    },
    "openai": {
      "display_name": "OpenAI",
      "models": {
        "gpt-4o": {
          "id": "gpt-4o",
          "provider": "openai",
          "status": "active",
          "aliases": [],
          "pricing": { "input": 2.50, "output": 10.00, "cache_read": 1.25 },
          "purpose": {
            "summary": "Modelo de propósito general de OpenAI para refactors e integración de APIs.",
            "strengths": ["api_integration", "code_generation", "reasoning"],
            "weaknesses": ["low_cost"],
            "recommended_for": ["refactors", "integración de APIs", "tareas de propósito general"],
            "avoid_for": ["tareas ultra económicas de volumen"],
            "routing_weight": 0.65
          },
          "source_url": "https://developers.openai.com/api/docs/pricing",
          "verified_at": "2026-09-26"
        },
        "gpt-4o-mini": {
          "id": "gpt-4o-mini",
          "provider": "openai",
          "status": "active",
          "aliases": [],
          "pricing": { "input": 0.15, "output": 0.60, "cache_read": 0.075 },
          "purpose": {
            "summary": "Modelo económico/rápido de OpenAI para tareas simples.",
            "strengths": ["low_latency", "low_cost", "boilerplate"],
            "weaknesses": ["reasoning", "architecture"],
            "recommended_for": ["tareas simples", "formateo"],
            "avoid_for": ["refactors complejos"],
            "routing_weight": 0.4
          },
          "source_url": "https://developers.openai.com/api/docs/pricing",
          "verified_at": "2026-09-26"
        },
        "gpt-5": {
          "id": "gpt-5",
          "provider": "openai",
          "status": "active",
          "aliases": [],
          "pricing": { "input": 1.25, "output": 10.00, "cache_read": 0.125 },
          "purpose": {
            "summary": "Modelo flagship de OpenAI (Codex CLI) para generación de código avanzada y tareas de desarrollo agentico.",
            "strengths": ["code_generation", "api_integration", "reasoning", "architecture"],
            "weaknesses": ["low_cost"],
            "recommended_for": ["generación de código complejo", "tareas agénticas de desarrollo", "integración de APIs avanzada"],
            "avoid_for": ["tareas ultra económicas de volumen"],
            "routing_weight": 0.8
          },
          "source_url": "https://developers.openai.com/api/docs/pricing",
          "verified_at": "2026-09-26",
          "notes": "Codex CLI. Verificar precio vigente por version en platform.openai.com/pricing."
        },
        "gpt-5.4-mini": {
          "id": "gpt-5.4-mini",
          "provider": "openai",
          "status": "active",
          "aliases": [],
          "pricing": { "input": 0.75, "output": 4.50, "cache_read": 0.075 },
          "purpose": {
            "summary": "Modelo intermedio de OpenAI (Codex CLI) para generación de código y boilerplate a costo moderado.",
            "strengths": ["code_generation", "boilerplate", "api_integration", "test_generation"],
            "weaknesses": ["architecture", "security_review", "reasoning"],
            "recommended_for": ["generación de código de volumen medio", "boilerplate", "tests estándar"],
            "avoid_for": ["decisiones de arquitectura", "análisis de seguridad"],
            "routing_weight": 0.55
          },
          "source_url": "https://developers.openai.com/api/docs/pricing",
          "verified_at": "2026-09-26",
          "notes": "Codex CLI."
        },
        "gpt-5.6-sol": {
          "id": "gpt-5.6-sol",
          "provider": "openai",
          "status": "active",
          "aliases": [],
          "pricing": { "input": 4.00, "output": 20.00, "cache_write": 5.00, "cache_read": 0.40 },
          "source_url": "https://developers.openai.com/api/docs/pricing",
          "verified_at": "2026-09-26",
          "notes": "Precio de contexto corto; el contexto largo tiene tarifa mayor y no está modelado."
        },
        "gpt-5.6-terra": {
          "id": "gpt-5.6-terra",
          "provider": "openai",
          "status": "active",
          "aliases": [],
          "pricing": { "input": 2.00, "output": 12.00, "cache_write": 2.50, "cache_read": 0.20 },
          "source_url": "https://developers.openai.com/api/docs/pricing",
          "verified_at": "2026-09-26",
          "notes": "Precio de contexto corto; el contexto largo tiene tarifa mayor y no está modelado."
        },
        "gpt-5.6-luna": {
          "id": "gpt-5.6-luna",
          "provider": "openai",
          "status": "active",
          "aliases": [],
          "pricing": { "input": 0.20, "output": 1.20, "cache_write": 0.25, "cache_read": 0.02 },
          "source_url": "https://developers.openai.com/api/docs/pricing",
          "verified_at": "2026-09-26",
          "notes": "Precio de contexto corto; el contexto largo tiene tarifa mayor y no está modelado."
        },
        "gpt-5.5": {
          "id": "gpt-5.5",
          "provider": "openai",
          "status": "active",
          "aliases": [],
          "pricing": { "input": 5.00, "output": 30.00, "cache_read": 0.50 },
          "source_url": "https://developers.openai.com/api/docs/pricing",
          "verified_at": "2026-09-26",